Description,URL,Price
"FiiO M3 Pro Full Touchscreen Lossless DSD HiFi Portable Music Player MP3,Support USB DAC,HD recording,E-Book,Built-in calculator",https://www.aliexpress.com/item/4000972188106.html,79.99
Hidizs AP80 PRO dual ESS9218P Bluetooth Portable Music Player MP3 USB DAC Hi-Res Audio DSD64/128 Apt-X/LDAC FM Step Counter,https://www.aliexpress.com/item/4000924308974.html,169
"FiiO M15 Flagship Android Dual AK4499 Hi-Res Protable Musc Player MP3 USB DAC,Samsung Exynos7872,XMOS XUF208,DSD512 768kHz/32bit",https://www.aliexpress.com/item/4000995400006.html,"1,349.99"
FiiO M3Pro/M3 Pro Hi-Res MP3 Player ES9218 HiFi Lossless Music Player USB DAC Support Resume mode Gapless play,https://www.aliexpress.com/item/4000960723826.html,79.99
Hidizs AP80 PRO dual ESS921 MP3 Bluetooth Music Player With Touch Screen HiFi Portable FLAC LDAC USB DAC DSD 64/128 FM Radio DAP,https://www.aliexpress.com/item/4000916726086.html,169
Soft TPU Clear Protective Case for FiiO M15 Music Player Quick Release Full Protection Cover Housing Shell for FiiO M15,https://www.aliexpress.com/item/4000860101044.html,15.91
Fiio BTR5 USB DAC Bluetooth 5.0 ES9218P CSR8675 Headphone Amplifier HiRes 3.5mm 2.5mm Balanced AAC/SBC/aptX/aptX LL/aptX H/LDAC,https://www.aliexpress.com/item/4000530247908.html,130.19
Fiio BTR5 Hi-Res USB DAC Headphone Amplifier Bluetooth 5.0 ES9218P CSR8675 3.5mm 2.5mm Balanced AAC/SBC/aptX/aptX LL/aptX H/LDAC,https://www.aliexpress.com/item/4000590367510.html,139.99
FiiO M11 Pro Android Hi-Res Music Player Bluetooth HiFi Lossless MP3 Player WiFi Aptx-HD Dual AK4497/THX AAA-78/LDAC/DSD/Tidal,https://www.aliexpress.com/item/4000465710581.html,645.05
"FiiO Q1 Mark II Native DSD USB DAC/Amplifier Q1 MKII for Apple iPhone iPad,FiiO DAC Ampifiler for Android/Computer/Sony/Xiaomi",https://www.aliexpress.com/item/4000069488625.html,100.22
FiiO AM3E 2.5MM + 3.5MM + 4.4MM Balanced Amplifier Module X7 exclusive amplifier module Q5s standard earphone amplifier part,https://www.aliexpress.com/item/4000555956913.html,107.99
FiiO M11 Pro Stainless Steel limited edition Hi-Res Player Dual AK4497/THX AAA-78/atpX HD/LDAC/Bluetooth/DSD/Tidal,https://www.aliexpress.com/item/4000622421489.html,783.99
"DD ddHiFi Knob-M15, Knob Cover for FiiO M15 Hi-Res Music Player, Stainless steel gold plating",https://www.aliexpress.com/item/4000882894956.html,14.99
FiiO K5 Pro HiFi Audio AK4493 Deskstop Amplifier AMP DAC with RCA/6.35/3.5mm output USB-B/OPT/COAX/RCA Input 768K/32Bit DSD512,https://www.aliexpress.com/item/4000130767086.html,159
FiiO M11 HIFI Audio Android-based Bluetooth Lossless Portable Music Player MP3 USB DAC WIFI/Air Play/Spotify aptx-HD/LDAC DSD,https://www.aliexpress.com/item/33001451741.html,427.49
Soft TPU Clear Crystal Protective Case for FiiO M11 Pro Music Player Accessories Skin Full Cover Case Sleeve For FiiO M11 Pro,https://www.aliexpress.com/item/4000431127712.html,14.49
FiiO M9 HIFI Balanced Output Portable High-Resolution Audio Android MP3 Player Bluetooth Lossless Music DAC WIFI DSD LDAC APTX,https://www.aliexpress.com/item/32966863423.html,247.99
FiiO M6 Hi-Res Bluetooth HiFi Music Portable MP3 Player USB DAC ES9018Q2C Based Android with aptX HD LDAC WiFi Air Play DSD,https://www.aliexpress.com/item/32961737369.html,149.90
FIIO M11 PRO Samsung Exynos 7872 Android 7.0 Bluetooth Protable Music Player MP3 AK4497EQ High-performance Audiophile DAC DSD256,https://www.aliexpress.com/item/4000478804030.html,658.63
HiBy R5 Android 8.1 HIFI Lossless Music MP3 Player Amazon Music Ultra HD/WiFi/Air Play/LDAC/DSD/aptX/Dual CS43198/Hi-Res/MQA,https://www.aliexpress.com/item/4000126543648.html,301.50
HiBy R6Pro (Aluminum Alloy)Lossless Music Player Digital Audio Hi-Fi Bluetooth MP3 Player Amazon Music Ultra HD,https://www.aliexpress.com/item/4000294891166.html,481.11
FiiO Q5s HIFI Audio Dual AK4493EQ Bluetooth 5.0 DAC Headphone Amplifier AMP PCM 768k/32bit DSD256 2.5/3.5/4.4mm made for iphone,https://www.aliexpress.com/item/4000032669972.html,325.59
JadeAudio(FiiO) EA3 HiFi Stereo 1BA(Knowles)+1Dynamic Hybrid Earphone IEM with 0.78 2pins Detachable Cables with Deep bass,https://www.aliexpress.com/item/4000419858364.html,49.99
FiiO M11 Pro Hi-Res Music Player AK4497EQ*2/THX AAA-78/Support MQA/atpX HD/LDAC/Bluetooth/DSD256/Tidal/Spotify,https://www.aliexpress.com/item/4000521166245.html,666.39
